"method","hyperparameters_searched","search_space","n_cv_folds","selection_criterion","chosen_configuration","other_fixed_settings"
"Global train/test split","(none)","Holdout fraction 0.20; set.seed(42); sample.int for test indices; n_train = 4345, n_test = 1086",NA,NA,NA,NA
"Global CV fold assignment","(none)","5 folds; set.seed(42); fold_id_train <- sample(rep(1:5, length.out = n_train)); passed to glmnet as foldid",5,NA,NA,NA
"OLS","(none)","—",5,"N/A (5-fold training RMSE reported only as reference)","N/A","lm(y ~ .); final z-score from full training; 5-fold CV RMSE uses z-score from CV-train only per fold"
"Ridge (glmnet)","lambda (alpha fixed at 0)","glmnet default penalty (lambda) sequence; family = gaussian; standardize = TRUE",5,"Minimum cross-validated deviance (lambda.min)","lambda.min = 5.026247414e+01","nfolds = 5; foldid = fold_id_train; raw X_train_raw; glmnet standardize=TRUE; predict with X_test_raw"
"LASSO (glmnet)","lambda (alpha fixed at 1)","glmnet default penalty (lambda) sequence; family = gaussian; standardize = TRUE",5,"Minimum cross-validated deviance (lambda.min)","lambda.min = 4.797796712e+00","nfolds = 5; foldid = fold_id_train; raw X_train_raw; glmnet standardize=TRUE; predict with X_test_raw"
"Regression tree (rpart)","cp, minbucket, minsplit","Full factorial grid: cp in {1e-04, 3e-04, 0.001, 0.003, 0.01, 0.03, 0.1}, minbucket in {3, 5, 10}, minsplit in {10, 20, 40} (63 combinations); per-fold z-scores from CV training rows only",5,"Minimum mean validation RMSE across folds","cp = 1e-04; minbucket = 3; minsplit = 20","method = anova; final z-score from full training; CV grid with per-fold z-scores"
"Random forest","mtry, ntree","Full factorial: mtry in {1, 9, 18, 26, 34}; ntree in {200, 400, 600} (15 combinations); same ntree in each CV fold and in final fit",5,"Minimum mean validation RMSE across folds","mtry = 9; ntree = 400","importance = FALSE; per-fold z-scores in CV; final fit on full-training z-scores"
"k-NN regression (FNN)","k (number of neighbors)","Odd k from 3 to 25 by 2; upper bound = min(25, max(5, floor(n_train/80)))",5,"Minimum mean validation RMSE across folds","k = 3","Final fit on full-training z-scores; CV with per-fold z-scores; zero-variance columns use scale 1"
